knu_id,title,lifecycle_phase,knot_ref,knu_class,status,owner,created_date,description,evidence_refs,compliance_status,start_date,end_date,notes
KNU-HAPSSE-LC02-0001,Endurance Requirement Set,LC02,KNOT-HAPSSE-LC02-0001,REQUIREMENT_SET,IN_PROGRESS,ASIT,2026-03-19,Formal endurance requirements including continuous flight duration energy reserve margins and structural fatigue allowance,,IN_PROGRESS,2026-03-19,,
KNU-HAPSSE-LC02-0002,Station-Keeping Requirement Set,LC02,KNOT-HAPSSE-LC02-0002,REQUIREMENT_SET,IN_PROGRESS,ASIT,2026-03-19,Station-keeping requirements: geofence radius wind field design envelope position accuracy and drift tolerance,,IN_PROGRESS,2026-03-19,,
KNU-HAPSSE-LC02-0003,Energy Balance Requirement Set,LC02,KNOT-HAPSSE-LC02-0003,REQUIREMENT_SET,IN_PROGRESS,ASIT,2026-03-19,Solar harvest requirements battery capacity day/night energy balance and power budget allocation,,IN_PROGRESS,2026-03-19,,
KNU-HAPSSE-LC02-0004,Payload Budget Requirement Set,LC02,KNOT-HAPSSE-LC02-0004,REQUIREMENT_SET,IN_PROGRESS,ASIT,2026-03-19,Mass power and thermal allocations for comms EO and ISR payload classes,,IN_PROGRESS,2026-03-19,,
KNU-HAPSSE-LC02-0005,Altitude and Performance Requirement Set,LC02,KNOT-HAPSSE-LC02-0005,REQUIREMENT_SET,IN_PROGRESS,ASIT,2026-03-19,Operating altitude band 18–22 km ascent performance descent limits and atmospheric performance margins,,IN_PROGRESS,2026-03-19,,
KNU-HAPSSE-LC02-0006,Regulatory Compliance Requirement Set,LC02,KNOT-HAPSSE-LC02-0006,REQUIREMENT_SET,IN_PROGRESS,ASIT,2026-03-19,Type certificate applicability ICAO annex compliance ITU spectrum filing and national airspace approval requirements,,IN_PROGRESS,2026-03-19,,
KNU-HAPSSE-LC02-0007,Structural Life Requirement Set,LC02,KNOT-HAPSSE-LC02-0007,REQUIREMENT_SET,IN_PROGRESS,ASIT,2026-03-19,Fatigue life cycles UV exposure tolerance thermal cycle count and structural inspection intervals,,IN_PROGRESS,2026-03-19,,
KNU-HAPSSE-LC02-0008,Launch and Recovery Requirement Set,LC02,KNOT-HAPSSE-LC02-0008,REQUIREMENT_SET,IN_PROGRESS,ASIT,2026-03-19,Launch window constraints transit configuration ground handling mass/volume envelope and recovery capture requirements,,IN_PROGRESS,2026-03-19,,
KNU-HAPSSE-LC02-0009,Data Architecture Requirement Set,LC02,KNOT-HAPSSE-LC02-0009,REQUIREMENT_SET,IN_PROGRESS,ASIT,2026-03-19,Downlink capacity latency budget data security and ground segment interface requirements,,IN_PROGRESS,2026-03-19,,
