knot_id,title,lifecycle_phase,obligation_source,status,owner,created_date,description,clause_refs,knu_refs,compliance_status,notes
KNOT-SSTO-LC03-0001,Forebody Shock Pre-compression System (ATA 53),LC03,ASIT,DRAFT,ASIT,2026-03-19,Define the forebody geometry and shock pre-compression architecture. Peak TPS temperature: 1600+ K. Shock system feeds propulsion inlet.,ATA 53,KNU-SSTO-LC03-0001;KNU-SSTO-LC03-0002,NOT_STARTED,Waverider-derived forebody; shock trains compress inlet airflow
KNOT-SSTO-LC03-0002,Wing Aerodynamic Configuration (ATA 57),LC03,ASIT,DRAFT,ASIT,2026-03-19,Define the wing configuration as low aspect-ratio delta/strake with lifting body blend for hypersonic and subsonic flight.,ATA 57,KNU-SSTO-LC03-0003;KNU-SSTO-LC03-0004,NOT_STARTED,Low AR delta / strake; lifting body blend for multi-regime performance
KNOT-SSTO-LC03-0003,Combined-Cycle Propulsion System (ATA 71-78),LC03,ASIT,DRAFT,ASIT,2026-03-19,Define the combined-cycle or rocket propulsion architecture using LH2/LOX propellants spanning all trajectory phases from M 0 to 25+.,ATA 71;ATA 72;ATA 73;ATA 74;ATA 75;ATA 76;ATA 77;ATA 78,KNU-SSTO-LC03-0005;KNU-SSTO-LC03-0006,NOT_STARTED,Combined-cycle (air-breathing + rocket) or pure rocket; LH2/LOX
KNOT-SSTO-LC03-0004,Thermal Protection System Architecture (ATA 51),LC03,ASIT,DRAFT,ASIT,2026-03-19,Define the metallic/CMC TPS architecture with active cooling capability. TPS receives coolant from cryogenic tanks.,ATA 51,KNU-SSTO-LC03-0007;KNU-SSTO-LC03-0008,NOT_STARTED,Metallic / CMC panels with active coolant loop fed from ATA 28 cryo tanks
KNOT-SSTO-LC03-0005,Cryogenic Tank System (ATA 28),LC03,ASIT,DRAFT,ASIT,2026-03-19,Define the integral LH2 + LOX cryogenic tank system providing propellant for propulsion and coolant for the thermal protection system.,ATA 28,KNU-SSTO-LC03-0009;KNU-SSTO-LC03-0010,NOT_STARTED,LH2 + LOX integral structural tanks; dual role as propellant and TPS coolant source
